25	Good afternoon. Chairman s ir, Galla sir and our Board of directors. And I was hearing earlier shareholders a lot of appreciation about Company S ecretary, staff and all. And I feel there is some communication gap whether they are asked and all, but as Secretarial standard issued by ICSI which clearly says that the general body meeting or AGM or gen eral meetings are conducted by Chairman. Even frequently asked questions on virtual VC also they have details. That's how their virtual meeting is conducted. So, Galla sir, since first speaker has come, you never ask who has to come or who has to go. Though sequence is there, but you are supposed to say okay, next speaker, please come on. Now, this meeting is conducted by moderator. Now the moderator, I don't know why they're asking , repeating the client ID. There is no regulation circular for repeating client ID because shareholder has requested you given us his details as a shareholder, he has submitted all the document , whatever requested, PAN and all why she is putting it. That is second ignorance. Third one is that the fact is the very first mail I have given to Mr. Vikas Sir as a Company Secretary to provide me my sequence number, speaker number along with the link, I was not g iven even till last night. I have given mail , no response. Today morning, I have contacted your telephone, your exchange NSE and BSE doesn't give latest telephone contact number. They still give Tirupati. So, really, I don't know it is the laxity and the part of Company Secretary not to update on exchanges wh ere shareholders always take the data online. Now, when I contacted your local office,2310some number it was a very bad response, so I have to disconnect. Next, again after one hour I attempted and I got them, t hen they said okay, we are sending it. So, this is the fact today and even Vikas sir may investigate on this. And I don't know earlier, Mr. Rajaram, sir or Sathish sir was t here, very cooperative, very informative, but I never have seen Mr. Vikas sir acting as a Company Secretary because moderator herself was told that 3 minutes. But tell me under which circular it says 3 minutes. They say if the speakers are more than 30-40 as per ICSI circular, frequently ask questions, you can approximate accordingly, but AGM is where as a shareholder I have followed all the company, law issued by company law, and accordingly we are there, and you are giving 3 minutes and conducted by moderator. So, I object to that Galla sir, now I will start my speaking and permit me if you want me to stop anytime, I will close it with your permission, sir, but not by moderator to kicking me out of the AGM . Sir, now I appreciate the first quarter, which has just now come today, really Q1 FY25, it is up revenue 13%, great sir yes and profit margin also has gone up 23. It is your immense contribution to the company and before that, another question is you had tie-up with Johnson Controls, now it is disconnected. Do you feel that you are maintaining the same trajectory which you are having along with Johnson Controls in the technology tie-up? That is my very first question. Now, the second question is your ARCSPL the unit subsidiary, the other one is ARACT and third unit subsidiary InoBat, these three are the potential growth for our future technologies, but in the annual report about them mention is very less. So, whether you want me to visit to your office and give a mail, please give me the detail on these subsidiaries, so that the technology, I being the electronics engineer may be appreciating and interacting with you for better of myself, my assets, and your company. Now, one question is still lingering my mind that Pollution Control Board of AP has given suspension orders, and those orders are being stayed by AP High Court. Now, there is no mention about this suspension, revocation and all in your annual report also. So, please update on that as a shareholder because most of the time in AP you were fighting on the se two units Chittoor and Cuddapah. It was a bad name for our company in the business of batteries . Now your association in the production lies on with Nile Limited, Nile Limited has given in their communications that they have closed the tab with Amara Raja. Are we having any tie-up with them because Nile Limited those that have closed its market cap is going there ? So, there is a surprise whether you have revoke d or there also you have started with Nile L imited. Now, fifth one is th e major term. You have changed the name of the company. Yes, Amara Raja Energy and Mobility. But where is the mobility, sir? It is only the energy; you are providing energy in different forms. Where is the mobility which signify mobility ? You have to plan on this mobility significance in the change of name. And last concern, I appreciate you are going through the Giga Corridor in Hyderabad. I am Badri Vishal Bajaj from Hyderabad only and from Osmania University that this Giga Corridor in Telangana is assets for my new government and also your expertise and the CAPEX of Rs. 9,500 crores is not a small amount which I believe that it is the internal a ccrual or from borrowings, but you could have appreciated and in volve shareholders or minority shareholders in contribution to the CAPEX which is the growth of the company and as Director has explained that this plant will go online anytime this year and inauguration will be there. So, being a local person, if you send an invitation, I will be happy to join and appreciate your effo rts and contribution and growth. So, I wish Galla sir, to take this company to new heights , keep the Company Secretary up to date and the chorus people they are hopeless, don't allow them to come because of this one, ignorance of the conducting meetings. Thank you very much,
26	Thank you. I now invite our next speaker shareholder, Mr. Sardaar Jasmeet Singh, DPID, Client ID IN 30226910987503, may we request you to kindly accept the prompt on the screen, unmute your audio and video and proceed ahead with the questions.
27	Respected Jayadev Galla ji - CMD; ED - Harshavardhana; ED – Vikramadithya, Board of Directors, key management personnel and shareholders attending this video call across globe, I am Jasmeet Singh from Delhi, greetings to you all. So, I am glad to witness yet another year of all round growth and consistently growing year-on-year w e have witnessed rerating of our investment, of our stock price and which is very satisfactory as far as we shareholders are concerned. I have gone through the annual report and it speaks volumes. I am very happy that to listen to Harshavardhana, it reassures that our company will continue to grow quarter-on-quarter year-on-year from here on. And I am sure that where we are today as far as our investment is concerned, it will grow many times from here on in next few years itself. Now , we have 3 -4 small questions and I will request the board to kindly respond to it. And at the same time, I will also request that the shareholders such as me, who are asking these questions should remain unmuted so that in case we need any clarification, we may seek when the answers are given. So, my first question is pertaining to say, revenue and profitability. While there is a constant increase in say our revenue, topline and bottom-line year-on-year, but what I see is that the profitability there is some scope of some say, increase in this especially, say our operating margins and net operating margins. In fact, 2-3 years back, we used to have better operating margins than what we have witnessed in the year under review. So, my question is, what strategies are in place to improve the company's profitability in the coming years? How does the company plan to manage costs amidst fluctuating raw material prices ? My next question is with regard to, say, product competitiveness, so how does Amara Raja Energy and Mobility differentiate itself from the competitors in the energy storage and mobility sectors? What are the key challenges that the company is facing from competitors and how are these being addressed? My third question pertains to say, R&D, so in this case what I want to know , just allow me that how much is the company investing in research and development to stay ahead in the rapidly evolving energy and mobility sector? Can you provide us details on the recent innovations that the company has achieved particularly in EVs? And my last question pertains to the ESG and EPR. Recently, the MCA has issued guidelines pertaining to the extended producer responsibility and so if you can kindly throw some light on this, it will be very helpful for shareholder like me to understand where we are as far as this point is c oncerned? I appreciate the high level of corporate governance. I thank chief of our finance Babu ji and I acknowledge Chief of Secretary and Compliance, Vikas Sabharwal ji to maintain the high level of corporate governance. With this , I end my note and I look forward to your responses on the questions that I have raised. Thank you from my side,
28	Thank you. I now invite our next speaker shareholder, Mr. Srikanth Jhawar. May we request you to kindly accept the prompt on the screen, unmute your audio and video and proceed ahead with your questions.
29	Respected Chairman and our Board of Directors, thank you. Please continue the meeting will be held in video conferencing. The first question is, sir, the day before yesterday, you have in BSE site that you have agreement with Ather. So, please give us some information about this agreement. And second question is now in two-wheeler, three-wheeler, which battery has got highest demand, please let us know about t his? And third question sir, now there is a demand for electric vehicles, then do you set up a service point or charging point in Andhra or all over India, so we have a lot of chances to get revenue from this. Please give us some information about that. And if you are a bonus candidate, then you think of issuing a bonus share in the future, then you will think that your equity is very small. Please give us some information about that. The way Q1 result has come, and we hope that our result will be better in Q2 if the result comes better then please give us interim dividend. It will be a great benefit to promoters as well as small investors hope for the dividend. Also,
30	Thank you. May I request Mr. A. V. Mani Sundaram. May we request you to kindly accept the prompt on your screen, unmute your audio and video and proceed ahead with your question.
31	I am shareholder, very happy to attend this meeting by means of video conference 39th Annual General Body meeting by video conference. Vikas, you have given good chance to speaker in outer, also Mr. Chairman sir Jayadev Galla, Harshavardhana Gourineni - ED, Vikramadithya, Vikas Sabharwal – Company Secretary are h appy to attend this meeting. They gave sent the annual report and also sen t the link also in time , we are happy. Then , a lot of companies are conducting AGM by means of hybrid, physical and also video conference. Can you give chance in future than I requesting my number ? Page number 253, EPS last year 2023, 39.92, this year 49.49, very good, happy and also you have manufacturing for electrical vehicle batteries for lithium and also charging points should be fixed in all over Indi a or main centers of the cities are they requesting. Page number 144, 10 years glance of performance is very good sir, you have given dividend, 137% shares Rs. 5.10, book value also raised, sir, very happy. Auditor contact number, e-mail is not mentioned in the annual report . Page number 275 doubtful should be clarified and please make correction. Then page number 250, a lot of disputes from the year of 2012 to 2018 and always sales tax back, entry tax law, income tax, central excise, finance tax, customs tax, wealth tax. Please have a settlement with the Government Department to minimize our disputes should be settled because declared by means of more penalties should be avoided, and also this year have good reserve. In next year 40th year, you can declare bonus share, sir, very happy. And we are requesting who are attending the meeting by means of video conference, please give hospitality of sweet box and dry fruits. I request for plant visit. Then , g ood whistleblower policies, sir. Audit is pleased to be controlled. Page number 160, battery wastage management rules. It gives some doubtful, 2022, please make it clarifications and CSR activities are good and I have one vehicle of LMV car and a two-wheeler. I used Amaron Battery but now, I bought one year back, but it is not supported, self-started and also please take it, have research and development issu e, some concession rate to dealer point rate. We are requesting all the shareholder and management should have good health and wealth. Thank you. Thanks a lot. Please give me a chance to meet all the shareholders to the management. Thank you. Thanks a lot, sir.
32	Thank you. I now invite our next speaker shareholder,
33	I, Atanu S aha, a shareholder of Am ara Raja Energy and Mobility Limited . My respect ed Chairman Mr. Jayadev Gala ji and Harshavardhana ji and Vikram ji and T. Sundaram ji and our Company Secretary Sabharwal ji and our CFO – Babu ji and all our shareholders and also our auditors, our scrutinizer and our committee, our audit, our regulation, our risks, our CSR, our stakeholder relationship committee and all members, today, it is 3rd August 2024. Our company is organizing 39th Annual General Meeting. Thanks to giving me a chance to speak. Sir, it is the first requirement on the Commission of Non-Executive and Non-Independent Directors. Sir, one thing, as far as the annual report concerned, it is completely maintaining its council, it is IIRC, International Integrated Reporting Council. It is maintaining reporting council and also maintaining its ESG, it is really great.
34	Thank you. We will move to the next speaker shareholder. Mr. Abhishek J, may we request to accept the prompt on the screen , unmute your audi o and video and proceed ahead with your questions.
35	First of all, I congratulate the management on the eve of 39th Annual General Body Meeting and trust all is well with you and your family in this challenging situation. Our company deserves much more respect than the current market cap after completing more than a decade of successful operations, profitability, d ividend history and becoming one of the strongest brands in the respective cities. Sir, first of all, I would like to know as of yet ho w many employees are there in our company and how many plants do, we have as of date and whether any new expansions, any new acquisitions we have been planned, I would like to know, sir. There are so many small companies which are being struggling, are we planning to acquire any new companies by way of merger or amalgamation, I would like to know from you, sir? And since EV vehicle has become a trend nowadays and more than 20% of the market has been captured by EV vehicles, so how are we focusing on the EV vehicles? I would like to know from you, sir, if you just give us any? Analyze on that and sir, as a request from other minority shareholders to conduct AGMs in hybrid mode because a greater number of shareholders are not able to join you because of the digital challenges in virtual platform, so you can consider building the hybrid mode , a greater number of participants can join in the meeting. You can get the valuable points such as an id ea that will be helpful for the management to empower in future. Sir, then the Company Secretary is always accessible and corporate governance is also very really good at the co mpany. We do appreciate and you ha ve also seen the brand during the time of ext raordinary General Body Meeting we have conducted in physical mode. So, it was a good experience for us to look around the factory. So, we do appreciate the management for that and kindly try to consider hybrid ATMs in the years to come. And where do you see the light at the end of the tunnel and what will be the growth figures in the first half and the second -half? I would like to know from you, sir and nothing much to ask, sir. Most of t he questions have been asked by my previous shareholders, so I do app reciate the management for that and Mr. Peterson has also joined, but some technical issue is not able to connect. Kindly call him in the end of the list once all the speaker shareholders are connected and nothing much to ask. I a lso hope that the management consider hybrid AGM in the 40th Annual General Body Meeting and stock price is also escalated and the par value is already Re. 1, so the shareholders are being eagerly waiting for bonus issue, sir. So, hope that the management will fulfill the wish and desire of the minority shareholders in the years to come. And there is nothing much to ask sir. I wish the company and the Board of Directors, a great success and prosperity in the coming fut ure and thank you for giving the opportunity. Hope to see you in the hybrid AGM next year. Thank you very much, sir.
36	Thank you. I now invite our next speaker shareholder Bharat Raj K., may we request you to kindly accept the prompt on your screen, unmute your audio and video and proceed ahead with your questions.
37	Very good afternoon, Chairman and Board of Directors my congratulations for wonderful performance. Chairman, y ou have given tie -up with Ather Company , future any global companies are entering tie -up with our company of the battery, sir, please let me know. Chairman sir, there is no questions already, every Arun Bopanna, every shareholder requested all the questions. My chairman sir, thank for Secretarial Services. Mr. Sabharwal and Mr. Naresh are successful. Finally, Mr. Chairman, sir, in the physical AGM when I met you, I have a wish that I want to see you as a Central Minister. You said that it is not in my hands. It is in God's hand. But I know I don't know why you back stepped at the recent elections, otherwise you maybe became a Central Minister and will be a proud because you are already successful in industrial list, but I want to see in politics as a successful leader, sir. So, I hope this we should be fulfilled in this year by going to Rajya Sabha and becoming a cabinet minister. Sir, th at is only wish to me sir. Once again, my best wishes to you. Take care, sir.
38	Thank you. I now invite the next speaker shareholder, Mr. Praveen Kumar. May we request you to kindly accept the prompt on your screen , unmute your audio and video and proceed ahead with your questions.
39	A very good afternoon to my respected Chairperson, well decorated team of Directors, my co- fellow shareholder, myself Praveen Kumar, joining this meeting from New Delhi. I have few observations which I love to share with the entire house. But before that, in this financial year, this is our fi rst interaction with the management. So, I wish entire management team each and every employee of our company a happy, healthy and prosperous future, sir. Coming down to my observation, it was the most excellent address by the management which is very informative for a retail investor like me. I am with the company for25 years, sir, and I see there are lots of up and down in the past , but the respective Chairperson, the leadership quality, the vision, the education you are having, which is unmatched in the industry. And last year it was very historical as far as all round growth is concerned. The future looks very bright because this is a very exciting space. I do remember clearly our respected PM, Narendra Modi sir, is very bullish on renewable energy and I am very thankful our company is pioneer in that aspect of it. So, we will be the biggest beneficiary in this. We have world class factory, world class R&D. Sir, if you see return in the last year, 600 to 1600, that is fantabulous as far as my investment i s concerned, excellent CSR activities by the management which truly reflect that the management who care for the community will grow leaps and bounds by the grace of God. My question to the management is, sir, AI is very much in flavor, and there are so many industries who are using it to cut down the cost and generate revenue. So, in the next 3 years, what will be the positive impact as far as the revenue is concerned, while using AI, just give me on percentage wise so I am very thankful to you? One more thing which I love to address here is I have deepest respect for our CS and his entirety because he has truly a multinational experience, he is going to be great asset for us as far as the communication is concerned with the retail investors. Tha t truly shows it is a red-carpet welcome from management side, truly shows that truly boosts our morale as far as investment is concerned. It is not about this event sir, which will be held once in a year, but during the course of time, if you have any upd ate of our company, they will be promptly replied. So, I am very thankful to our respected CFO , respected CS for their very proactive approach, the greatest communication with the retail investor. With this opportunity and patient hearing, I wish you all t he luck and brighter future for all of us because you are supporting so hard to create sustainable value for us. Thank you, sir.
40	
